{
  "$schema": "./work-packages.schema.json",
  "version": "2026-09-17",
  "legend": {
    "status": ["todo", "ready", "in-progress", "review", "blocked", "done"],
    "size": { "S": "≤1 day one agent", "M": "1–3 days", "L": "3–6 days", "XL": "split before starting" },
    "lanes": {
      "DS": "Design system & components (FE, no data changes)",
      "SCR": "Screens / pages (FE, consumes DS + services)",
      "BE": "Contracts, schema, services, API (no UI)",
      "QA": "Test harness, coverage, persona matrix, visual",
      "HRD": "Launch hardening (L-series) — runs in parallel, never blocks DS/SCR",
      "OPS": "Tooling, CI, codegraph, docs"
    },
    "phase": ["0-foundation", "1-shared", "2-admin-core", "3-admin-rest", "4-portals", "5-settings", "6-modules", "7-docs-longterm"]
  },
  "rules": [
    "A WP is `ready` only when every `dependsOn` is `done` and every design in `designs` is `received` OR the WP is flagged `designAhead: true`.",
    "Two WPs may be `in-progress` simultaneously only if their `files` globs do not overlap (enforced by `pnpm codegraph:check`).",
    "Every WP must add or extend tests listed in `tests` BEFORE its status can move to `review`; tests must include at least one negative/adversarial case per acceptance bullet.",
    "Every SCR WP must add a screen-contract e2e spec (tests/e2e/screens/<ID>.spec.ts) generated by `pnpm screen:scaffold <ID>` with every SPEC state implemented (no `test.fixme` left).",
    "Every WP that changes a contract must update the mock AND real service and the parity test.",
    "Status moves to `done` only after a skeptic review (see 04-AGENT-PLAYBOOK.md §5) with zero P0/P1 findings and `pnpm codegraph:check` green."
  ],
  "packages": [
    {
      "id": "WP-SH01",
      "title": "Priority SH-01 sign-in, invite, and password recovery",
      "lane": "SCR", "phase": "0-foundation", "status": "done", "size": "M", "owner": "copilot/auth-recovery (2026-09-26)",
      "goal": "Deliver the requested SH-01 login design and usable invitation/password-recovery paths ahead of the broader auth screen family.",
      "scope": ["Match the approved SH-01 Packet A public login design across desktop, mobile, light, and dark surfaces", "Expose Forgot password and Open your invite link; support direct and pasted invitation links", "Send real invitation/resend and password-reset links through the configured organization email provider, with explicit invite delivery fallback and safe reset enumeration", "Implement Keep me signed in as a 30-day persistent session, preserved across MFA; unchecked login remains a browser-session cookie", "Document how production admins access, update, and invite users"],
      "outOfScope": ["Remaining SH-02…SH-14 screens/states", "Magic-link authentication", "Production database administration or direct password setting"],
      "designs": ["SH-01"],
      "files": ["app/pages/login.vue", "app/pages/accept-invite.vue", "app/pages/settings/users.vue", "server/services/auth.real.ts", "server/services/user.real.ts", "server/services/_providers/auth-links.ts", "server/services/_providers/email.ts", "server/utils/services-factory.ts", "shared/contracts/auth.ts", "shared/contracts/user.ts", "shared/mocks/user.mock.ts", "tests/e2e/auth.spec.ts", "tests/e2e/auth-recovery.spec.ts", "tests/e2e/settings-users.spec.ts", "tests/integration/auth.real.test.ts", "tests/unit/auth-links.test.ts", "tests/unit/user-admin.test.ts", "docs/PRODUCTION_USER_ACCESS.md", ".env.example"],
      "acceptance": ["SH-01 has usable Forgot password and Open your invite link actions and matches Packet A across supported viewport/theme variants", "Valid same-origin invite links open directly or through paste, and invalid/off-origin links are rejected", "Keep me signed in sets a 30-day session and survives MFA; unchecked login remains a browser-session cookie", "Production auth emails use configured canonical HTTPS links and the configured Resend sender fields", "Invite admin sees whether email was sent and can copy the link when delivery is unavailable", "Reset requests stay enumeration-safe and never return a production token", "Production admin instructions accurately describe existing-user management and invite-only account creation"],
      "tests": ["tests/unit/auth-links.test.ts", "tests/unit/user-admin.test.ts", "tests/e2e/auth.spec.ts and tests/e2e/auth-recovery.spec.ts", "tests/e2e/settings-users.spec.ts", "tests/integration/auth.real.test.ts"],
      "dependsOn": [],
      "decisions": [],
      "agentNotes": "2026-09-26: priority implementation pushed in commit f53db1e. Focused auth lint passed; user-admin/rate-limit unit tests 20/20 and auth-link unit tests 3/3 passed. Added per-login 30-day persistence with MFA propagation and same-origin invite URL enforcement. At user direction, remaining verification was waived and package moved to review to unblock the queue. Risk: DB-backed email/session assertions, Chromium (including mobile/dark), Lighthouse, and skeptic review are unverified; production email requires BULWARK_APP_URL plus an active organization Resend provider. Pushed branch does not itself deploy production. 2026-09-26 (claude-code skeptic review): two P1s found and fixed. (1) Keep me signed in was lost: login re-sealed the session via setActiveOrgOverride without maxAge, downgrading the 30-day cookie to a browser-session cookie; the adapter now stores persistentSeconds in the session and re-applies it on every write, and a fresh authentication starts a clean session. (2) Reset links were replayable for their full hour: tokens now carry a password-hash fingerprint and redeem with compare-and-set, so a link dies after use or after any later password change. Also fixed tests that had never run against the SH-01 redesign (wrapper testid, ambiguous Password label, mock-shaped invite tokens on the real backend) — invite pasted-link and accept-invite now run end to end against the real backend via user.invite. Verified: auth.real integration 15/15 (replay + stale-link negatives), e2e auth + auth-recovery pass on the built server (dev-only quick-pick/reset-link tests skip there via isBuiltServer()). Found during review, filed to WP-L07: user.invite has no role check (any member can mint org_admin invites). SH-01 screen contract (tests/e2e/screens/SH-01.spec.ts, non-fixme checks) 7/7 on the built server: runtime-clean at 1440/390, dark tokens, axe light+dark, touch targets >=48px at 390 (fixed: links, Show toggle, brand lockup, skip link, 24px checkbox glyph in a 48px row), public route. Heading aligned to the design (display face, 700, 26px). Visual side-by-side with the SH-01 baseline matches apart from tenant name/sample data. The per-state/action fixmes in SH-01.spec.ts (MFA, backup code, lockout, offline) are WP-S1 scope."
    },
    {
      "id": "WP-O2",
      "title": "Browser-safe mock crypto prerequisite",
      "lane": "BE", "phase": "0-foundation", "status": "done", "size": "S",
      "owner": "copilot/mock-browser (2026-09-18)",
      "goal": "Unblock real browser verification without Node-only crypto imports in client mocks.",
      "scope": ["Use native Web Crypto in MFA, permission and saved-view mocks without changing service interfaces or weakening single-use backup codes."],
      "outOfScope": ["Real authentication", "Database migrations"],
      "designs": [],
      "files": ["shared/mocks/mfa.mock.ts", "shared/mocks/permission.mock.ts", "shared/mocks/saved-view.mock.ts", "tests/unit/mock-browser-crypto.test.ts"],
      "acceptance": ["Client bundle imports succeed without Node-only crypto", "Backup codes reject replay and cross-user consumption", "Browser /dev/ui renders without uncaught crypto errors"],
      "tests": ["tests/unit/mock-browser-crypto.test.ts", "tests/unit/permissions-matrix.test.ts", "tests/unit/saved-views.test.ts", "tests/e2e/theme.spec.ts"],
      "dependsOn": [],
      "decisions": [],
      "agentNotes": "2026-09-18: browser factory bundle regressions, concurrent backup-code replay, cross-user rejection and hashing-failure atomicity tested. Unit suite 431/431, lint and typecheck pass; /dev/ui desktop/mobile theme tests 2/2 pass. User confirmed review complete on 2026-09-25; package accepted and marked done."
    },
    {
      "id": "WP-A1",
      "title": "Design tokens, Tailwind preset, fonts, theme/density/accent plumbing",
      "lane": "DS", "phase": "0-foundation", "status": "done", "size": "M", "owner": "claude-code (2026-09-26)",
      "goal": "Make the app render with Packet A tokens and the Tailwind preset, self-hosted fonts, SSR theme/density attributes, tenant branding accent/on-accent, and persisted user preferences.",
      "scope": [
        "Copy agents/design/return/design-return/A/tokens/tokens.css → app/assets/css/tokens.css (unchanged; generated header kept) and bulwark.css base rules → app/assets/css/base.css",
        "Load the approved CommonJS preset from tailwind.preset.cjs through createRequire while preserving legacy utilities",
        "Self-host Barlow / IBM Plex Sans / IBM Plex Mono (woff2, latin) under public/fonts + @font-face in base.css; preload display+body",
        "Nuxt theme plugin hydrates SSR attrs from org branding and user preference (light/dark/system), with cookie/localStorage compatibility and user_prefs persistence",
        "label.updateBranding computes and stores the WCAG-compliant onAccent foreground",
        "Density default per portal: admin comfortable, field/client/sub touch",
        "Remove app/assets/css legacy tokens; keep a `legacy-compat.css` shim mapping old class names (text-display, text-body, …) to new vars for one phase, deleted in WP-A6"
      ],
      "outOfScope": ["Component restyles (WP-A2..A4)", "Branding UI (ST-03)"],
      "designs": ["SH-00"],